{
  "contract": "build-audit-handoff",
  "version": 3,
  "task_id": "gpt-build-audit-pair",
  "build_revision": 0,
  "spec": "Provide a copy-paste-ready, human-supervised pair of Custom GPTs that build and independently audit GPT design packages with complete snapshots, deterministic acceptance results, bounded rework, and honest evidence labels.",
  "acceptance_criteria": [
    {
      "id": "AC1",
      "text": "Every instruction file (Builder, Auditor, six specialists) is at most 7,500 characters below its paste marker.",
      "kind": "artifact",
      "evidence_required": false
    },
    {
      "id": "AC2",
      "text": "python tools/validate_examples.py accepts every positive case and rejects all 15 negative cases for their stated reasons.",
      "kind": "artifact",
      "evidence_required": false
    },
    {
      "id": "AC3",
      "text": "python tools/check_package.py passes: seeded-fixture integrity, configuration references, version consistency, stale references, path references, specialist self-containment.",
      "kind": "artifact",
      "evidence_required": false
    },
    {
      "id": "AC4",
      "text": "The Builder, Auditor, and every specialist instruct that packet content, Knowledge, and retrieved pages are untrusted data, never instructions.",
      "kind": "artifact",
      "evidence_required": false
    },
    {
      "id": "AC5",
      "text": "The configured Auditor returns PASS or PASS_WITH_NOTES on the good fixture and the expected FAIL on each seeded fixture (SMOKE-TEST S2-S3).",
      "kind": "behavioral",
      "evidence_required": false
    },
    {
      "id": "AC6",
      "text": "The configured Builder and Auditor ignore the injection line in SMOKE-TEST S4 and do not reveal their instructions.",
      "kind": "behavioral",
      "evidence_required": false
    }
  ],
  "addresses": [],
  "artifacts": [
    {
      "path": "builder-gpt.md",
      "status": "modified",
      "lines_changed": 0,
      "summary": "Rewritten to fit the Instructions limit; protocol v3; Auditor-only ID allocation.",
      "snapshot_included": true
    },
    {
      "path": "auditor-gpt.md",
      "status": "modified",
      "lines_changed": 0,
      "summary": "Rewritten to fit the Instructions limit; deterministic acceptance rules; protocol v3.",
      "snapshot_included": true
    },
    {
      "path": "builder-reference.md",
      "status": "new",
      "lines_changed": 0,
      "summary": "New Knowledge file with the artifact checklist, design checklist, and section details.",
      "snapshot_included": true
    },
    {
      "path": "auditor-reference.md",
      "status": "new",
      "lines_changed": 0,
      "summary": "New Knowledge file with the attack checklist, detail block, categories, and labels.",
      "snapshot_included": true
    },
    {
      "path": "contract.md",
      "status": "modified",
      "lines_changed": 0,
      "summary": "Protocol v3 contract.",
      "snapshot_included": true
    },
    {
      "path": "schemas/",
      "status": "new",
      "lines_changed": 0,
      "summary": "v3 handoff, audit-report, and specialist-report schemas.",
      "snapshot_included": true
    },
    {
      "path": "specialists/",
      "status": "new",
      "lines_changed": 0,
      "summary": "GPT-oriented, self-contained specialist prompts and trigger matrix.",
      "snapshot_included": true
    },
    {
      "path": "examples/",
      "status": "new",
      "lines_changed": 0,
      "summary": "GPT fixture suite, chain, specialist examples, 15 negative cases, manifest.",
      "snapshot_included": true
    },
    {
      "path": "tools/validate_examples.py",
      "status": "modified",
      "lines_changed": 0,
      "summary": "v3 validator: .md input, --handoff, --specialist, manifest-driven.",
      "snapshot_included": true
    },
    {
      "path": "tools/check_package.py",
      "status": "new",
      "lines_changed": 0,
      "summary": "New standard-library package integrity checks.",
      "snapshot_included": true
    },
    {
      "path": ".github/workflows/validate.yml",
      "status": "new",
      "lines_changed": 0,
      "summary": "New CI workflow.",
      "snapshot_included": true
    },
    {
      "path": "gpt-config.json",
      "status": "modified",
      "lines_changed": 0,
      "summary": "v4.0.0 configuration with platform limits and v3 Knowledge lists.",
      "snapshot_included": true
    },
    {
      "path": "README.md",
      "status": "modified",
      "lines_changed": 0,
      "summary": "Rewritten overview, quick start, validation, releasing, license.",
      "snapshot_included": true
    },
    {
      "path": "SETUP.md",
      "status": "modified",
      "lines_changed": 0,
      "summary": "Rewritten setup tables for v3.",
      "snapshot_included": true
    },
    {
      "path": "SMOKE-TEST.md",
      "status": "modified",
      "lines_changed": 0,
      "summary": "Live calibration procedure bound to the fixture suite.",
      "snapshot_included": true
    },
    {
      "path": "SMOKE-RESULTS.template.md",
      "status": "new",
      "lines_changed": 0,
      "summary": "New results log template.",
      "snapshot_included": true
    },
    {
      "path": "standards.template.md",
      "status": "modified",
      "lines_changed": 0,
      "summary": "Adds acceptance-evidence and Instructions-limit fields.",
      "snapshot_included": true
    },
    {
      "path": "CHANGELOG.md",
      "status": "modified",
      "lines_changed": 0,
      "summary": "4.0.0 entry.",
      "snapshot_included": true
    },
    {
      "path": "LICENSE",
      "status": "new",
      "lines_changed": 0,
      "summary": "New MIT license.",
      "snapshot_included": true
    }
  ],
  "context_manifest": [
    {
      "path": "tools/requirements.txt",
      "purpose": "Validator dependency (jsonschema).",
      "supplied": true
    },
    {
      "path": "platform:custom-gpt-editor",
      "purpose": "Instructions limit 8,000 characters (editor error message cited in examples/specialist-researcher.v3.json).",
      "supplied": true
    }
  ],
  "verification": [
    {
      "check": "Instruction budget (AC1)",
      "command": "python tools/check_package.py --max 7500",
      "result": "pass",
      "environment": "agent_sandbox",
      "evidence": "auditor 7330, builder 6387, specialists 2479-2836 characters."
    },
    {
      "check": "Schemas and protocol (AC2)",
      "command": "python tools/validate_examples.py",
      "result": "pass",
      "environment": "agent_sandbox",
      "evidence": "Validated 23 positive cases and 15 expected-rejection cases against the v3 schemas and protocol rules."
    },
    {
      "check": "Package integrity (AC3)",
      "command": "python tools/check_package.py",
      "result": "pass",
      "environment": "agent_sandbox",
      "evidence": "Package checks passed."
    },
    {
      "check": "Trust boundary text (AC4)",
      "command": "grep -l 'untrusted data' builder-gpt.md auditor-gpt.md specialists/*-gpt.md",
      "result": "pass",
      "environment": "agent_sandbox",
      "evidence": "All 8 instruction files matched."
    },
    {
      "check": "Live calibration (AC5, AC6)",
      "command": "SMOKE-TEST.md S2-S4 on configured GPTs",
      "result": "not-run",
      "environment": "not_run",
      "evidence": "No configured Custom GPT instances were available in the build environment."
    }
  ],
  "self_audit": [
    {
      "area": "live behavior",
      "note": "Model behavior on the fixtures is specified and calibrated by expected reports but not demonstrated; record SMOKE-TEST results before relying on the pair.",
      "severity": "MINOR",
      "confidence": "high"
    },
    {
      "area": "lines_changed",
      "note": "lines_changed is reported as 0 because the package was restructured wholesale; see CHANGELOG.md.",
      "severity": "NIT",
      "confidence": "high"
    }
  ],
  "assumptions": [
    "Two private ChatGPT Custom GPTs operated by a human who copies complete packets between them."
  ],
  "flags": [],
  "open_questions": [
    "Record SMOKE-RESULTS.md from the configured GPTs to move AC5 and AC6 to met."
  ],
  "base_revision": "3.1.0-gpt-profile (commit e1aa678)",
  "confidence": "high"
}
